{
  "schema_version": "1.0",
  "verdict_id": "verdict-omp-cursor-vis-abc42-a2",
  "format": "html",
  "visual_plan_digest": "d73e0ad5d83ca792512d2d00f68d43df2e0a56eb87faa370971637c39b3f5cf4",
  "candidate_artifact_digest": "1b13adf41bbb926203e1e7b69f187335e24f3d8e08fef5405130573e18741c75",
  "render_evidence_digest": "038638ea72ad5a91227dd72e973dc845c9f3f67ecd6b331a98a6c9987b41e116",
  "producer_identity": "zcode-main-thread-glm53",
  "verifier_identity": "omp-cursor-default-auto",
  "verdict": "rejected",
  "domains": [
    {
      "domain": "copy_zh",
      "status": "rejected",
      "criteria": [
        "用户可见文案为中文；无内部状态名、路径、定位符或英文系统术语泄漏",
        "证据不足处使用显式中文声明（如暂无公开记录），不使用占位符或空白模拟"
      ],
      "evidence_refs": [
        "runs/pnh-vertical/abc-v42/reports/A/v1/html/efficacy.html",
        "packets/2026-09-18-omp-visual/screenshots/A/chromium/1440__efficacy.html.png",
        "runs/pnh-vertical/abc-v42/reports/A/v1/html/regulatory.html",
        "packets/2026-09-18-omp-visual/screenshots/A/chromium/1440__regulatory.html.png"
      ]
    },
    {
      "domain": "hierarchy_density",
      "status": "accepted",
      "criteria": [
        "总览页优先呈现结论性信息，逐项细节下沉到折叠表或详情页",
        "同一数据在图、表、抽屉三投影中保持同源一致"
      ],
      "evidence_refs": [
        "runs/pnh-vertical/abc-v42/reports/A/v1/html/overview.html",
        "packets/2026-09-18-omp-visual/screenshots/A/chromium/1440__overview.html.png",
        "runs/pnh-vertical/abc-v42/reports/A/v1/html/efficacy.html",
        "packets/2026-09-18-omp-visual/screenshots/A/chromium/1440__efficacy.html.png"
      ]
    },
    {
      "domain": "typography_spacing",
      "status": "accepted",
      "criteria": [
        "字号使用康哲刻度（正文不小于 12px），行距与间距符合 4/8 基线",
        "长药品名/试验名换行不截断关键标识"
      ],
      "evidence_refs": [
        "packets/2026-09-18-omp-visual/screenshots/A/chromium/320__efficacy.html.png",
        "packets/2026-09-18-omp-visual/screenshots/A/chromium/1440__efficacy.html.png",
        "runs/pnh-vertical/abc-v42/reports/A/v1/html/assets/portal.css"
      ]
    },
    {
      "domain": "color_legibility",
      "status": "accepted",
      "criteria": [
        "四科室令牌（橙/蓝/绿/紫）跨页面语义一致",
        "正文与背景对比度满足可读性；不单独依赖颜色区分结论"
      ],
      "evidence_refs": [
        "packets/2026-09-18-omp-visual/screenshots/A/chromium/1440__overview.html.png",
        "packets/2026-09-18-omp-visual/screenshots/A/chromium/1440__safety.html.png",
        "runs/pnh-vertical/abc-v42/reports/A/v1/html/assets/portal.css"
      ]
    },
    {
      "domain": "charts_tables",
      "status": "accepted",
      "criteria": [
        "图表均有来源声明绑定与坐标量纲标注；空态显式声明而非空墙",
        "图表与对应表格数值一致（同源投影）"
      ],
      "evidence_refs": [
        "packets/2026-09-18-omp-visual/screenshots/A/chromium/1440__efficacy.html.png",
        "packets/2026-09-18-omp-visual/screenshots/A/chromium/1440__safety.html.png",
        "runs/pnh-vertical/abc-v42/reports/A/v1/html/efficacy.html",
        "runs/pnh-vertical/abc-v42/reports/A/v1/html/safety.html"
      ]
    },
    {
      "domain": "interaction_consistency",
      "status": "accepted",
      "criteria": [
        "筛选、下钻、抽屉、搜索、键盘、减弱动效六类触发行为全站一致",
        "键盘可达：折叠表与抽屉可用 Tab/Enter 操作"
      ],
      "evidence_refs": [
        "packets/2026-09-18-omp-visual/render-evidence-a.json",
        "runs/pnh-vertical/abc-v42/reports/A/v1/html/efficacy.html",
        "packets/2026-09-18-omp-visual/screenshots/A/chromium/1440__efficacy.html.png"
      ]
    },
    {
      "domain": "format_rendering",
      "status": "accepted",
      "criteria": [
        "Chromium 与 WebKit 渲染一致，无布局断裂或水平溢出",
        "四类视口下导航、表格与图表保持可用"
      ],
      "evidence_refs": [
        "packets/2026-09-18-omp-visual/screenshots/A/chromium/1440__efficacy.html.png",
        "packets/2026-09-18-omp-visual/screenshots/A/webkit/1440__efficacy.html.png",
        "packets/2026-09-18-omp-visual/screenshots/A/chromium/320__safety.html.png",
        "packets/2026-09-18-omp-visual/render-evidence-a.json"
      ]
    }
  ],
  "created_at": "2026-09-20T12:14:12.736Z"
}
